Problem latex,Answer,Solution,Source,Year,Type,Competition,Difficulty,Img
"Grizzly is 6 feet tall. He measures his shadow to be 4 feet long. At the same time, his friend Panda helps him measure the shadow of a nearby lamp post, and it is 6 feet long. How tall is the lamp post in feet?",9,,BmMT 2018 Individual #4,2018,Geometry,BmMT,1,
Jerry is currently twice as old as Tom was 7 years ago. Tom is 6 years younger than Jerry. How many years old is Tom?,20,,BmMT 2018 Individual #5,2018,Algebra,BmMT,1,
"Out of the 10,000 possible four-digit passcodes on a phone, how many of them contain only prime digits?",256,,BmMT 2018 Individual #6,2018,Counting,BmMT,1,
"It started snowing, which means Moor needs to buy snow shoes for his 6 cows and 7 sky bison. A cow has 4 legs, and a sky bison has 6 legs. If Moor has 36 snow shoes already, how many more shoes does he need to buy? Assume cows and sky bison wear the same type of shoe and each leg gets one shoe.",30,,BmMT 2018 Individual #7,2018,Algebra,BmMT,1.5,
How many integers n with $1\le n\le100$ have exactly 3 positive divisors?,4,,BmMT 2018 Individual #8,2018,Number Theory,BmMT,1.5,
James has three red candies and 3 green candies. 3 people come in and each randomly take 2 candies. What is the probability that no one got 2 candies of the same color? Express your answer as a decimal or a fraction in lowest terms.,2/5,,BmMT 2018 Individual #9,2018,Counting,BmMT,1.5,
"When Box flips a strange coin, the coin can land heads, tails, or on the side. It has a $\frac{1}{10}$ probability of landing on the side, and the probability of landing heads equals the probability of landing tails. If Box flips a strange coin 3 times, what is the probability that the number of heads flipped is equal to the number of tails flipped? Express your answer as a decimal or a fraction in lowest terms.",49/400,,BmMT 2018 Individual #10,2018,Counting,BmMT,2,
"James is travelling on a river. His canoe goes 4 miles per hour upstream and 6 miles per hour downstream. He travels 8 miles upstream and then 8 miles downstream (to where he started). What is his average speed, in miles per hour? Express your answer as a decimal or a fraction in lowest terms.",24/5,,BmMT 2018 Individual #11,2018,Algebra,BmMT,1.5,
"Four boxes of cookies and one bag of chips cost exactly 1000 jelly beans. Five bags of chips and one box of cookies cost less than 1000 jelly beans. If both chips and cookies cost a whole number of jelly beans, what is the maximum possible cost of a bag of chips?",156,,BmMT 2018 Individual #12,2018,Algebra,BmMT,2,
"June is making a pumpkin pie, which takes the shape of a truncated cone. The pie tin is 18 inches wide at the top, 16 inches wide at the bottom, and 1 inch high. How many cubic inches of pumpkin filling are needed to fill the pie?",217π/3,,BmMT 2018 Individual #13,2018,Geometry,BmMT,2.5,
"For two real numbers a and b, let $a\#b=ab-2a-2b+6$ Find a positive real number x such that $(x\#7)\#x=82$.",6,,BmMT 2018 Individual #14,2018,Algebra,BmMT,2,
Find the sum of all positive integers n such that $\frac{n^{2}+20n+51}{n^{2}+4n+3}$ is an integer.,26,,BmMT 2018 Individual #15,2018,Algebra,BmMT,2,
Let ABC be a right triangle with hypotenuse AB such that $AC=36$ and $BC=15$ A semicircle is inscribed in ABC such that the diameter XC of the semicircle lies on side AC and that the semicircle is tangent to AB. What is the radius of the semicircle?,10,,BmMT 2018 Individual #16,2018,Geometry,BmMT,2,
"Let a and b be relatively prime positive integers such that the product ab is equal to the least common multiple of 16500 and 990. If $\frac{16500}{a}$ and $\frac{990}{b}$ are both integers, what is the minimum value of $a+b$?",599,,BmMT 2018 Individual #17,2018,Number Theory,BmMT,2.5,
Let x be a positive real number so that $x-\frac{1}{x}=1$ Compute $x^{8}-\frac{1}{x^{8}}$,21√5,,BmMT 2018 Individual #18,2018,Algebra,BmMT,3,
"Six people sit around a round table. Each person rolls a standard 6-sided die. If no two people sitting next to each other rolled the same number, we will say that the roll is valid. How many different rolls are valid?",15630,,BmMT 2018 Individual #19,2018,Counting,BmMT,3,
"Given that $\frac{1}{31}=0.\overline{a_{1}a_{2}a_{3}a_{4}a_{5}\cdot\cdot\cdot a_{n}}$ (that is, $\frac{1}{31}$ can be written as the repeating decimal expansion $0.a_{1}a_{2}\cdot\cdot\cdot a_{n}a_{1}a_{2}\cdot\cdot\cdot a_{n}a_{1}a_{2}\cdot\cdot\cdot),$ what is the minimum value of n ?",15,,BmMT 2018 Individual #20,2018,Number Theory,BmMT,3.5,
What is the sum of the first 12 positive integers?,78,,BmMT 2018 Team #1,2018,Number Theory,BmMT,1,
How many positive integers less than or equal to 100 are multiples of both 2 and 5?,10,,BmMT 2018 Team #2,2018,Number Theory,BmMT,1,
Alex has a bag with 4 white marbles and 4 black marbles. She takes 2 marbles from the bag without replacement. What is the probability that both marbles she took are black? Express your answer as a decimal or a fraction in lowest terms.,3/14,,BmMT 2018 Team #3,2018,Counting,BmMT,1,
How many 5-digit numbers are there where each digit is either 1 or 2?,32,,BmMT 2018 Team #4,2018,Counting,BmMT,1,
An integer a with $1\le a\le10$ is randomly selected. What is the probability that $\frac{100}{a}$ is an integer? Express your answer as a decimal or a fraction in lowest terms.,1/2,,BmMT 2018 Team #5,2018,Counting,BmMT,1.5,
"Two distinct non-tangent circles are drawn so that they intersect each other. A third circle, distinct from the previous two, is drawn. Let P be the number of points of intersection between any two circles. How many possible values of P are there?",5,,BmMT 2018 Team #6,2018,Geometry,BmMT,2,
"Let x, y, z be nonzero real numbers such that $x+y+z=xyz.$ Compute
    \[\frac{1+yz}{yz}+\frac{1+xz}{xz}+\frac{1+xy}{xy}.\]",4,,BmMT 2018 Team #7,2018,Algebra,BmMT,2,
"How many positive integers less than $10^{6}$ are simultaneously perfect squares, cubes, and fourth powers?",3,,BmMT 2018 Team #8,2018,Number Theory,BmMT,2,
"Let $C_{1}$ and $C_{2}$ be two circles centered at point O of radii 1 and 2, respectively. Let A be a point on $C_{2}$. We draw the two lines tangent to $C_{1}$ that pass through A, and label their other intersections with $C_{2}$ as B and C. Let x be the length of minor are BC. Compute x.",4π/3,,BmMT 2018 Team #9,2018,Geometry,BmMT,2,
A circle of area $\pi$ is inscribed in an equilateral triangle. Find the area of the triangle.,3√3,,BmMT 2018 Team #10,2018,Geometry,BmMT,2,
"Julie runs a 2 mile route every morning. She notices that if she jogs the route 2 miles per hour faster than normal, then she will finish the route 5 minutes faster. How fast (in miles per hour) does she normally jog?",6,,BmMT 2018 Team #11,2018,Algebra,BmMT,2.5,
"Let ABCD be a square of side length 10. Let EFGH be a square of side length 15 such that E is the center of ABCD, EF intersects BC at X, and EH intersects CD at Y (shown below). If $BX=7$ what is the area of quadrilateral EXCY?",25,,BmMT 2018 Team #12,2018,Geometry,BmMT,2.5,
"How many solutions are there to the system of equations
    \begin{align*}
        a^{2}+b^{2}&=c^{2} \\
        (a+1)^{2}+(b+1)^{2}&=(c+1)^{2}
    \end{align*}
    if a, b, and c are positive integers?",0,,BmMT 2018 Team #13,2018,Number Theory,BmMT,2.5,
A square of side length s is inscribed in a semicircle of radius r. Compute $\frac{s}{r}$.,2√5/5,,BmMT 2018 Team #14,2018,Geometry,BmMT,2,
S is a collection of integers n with $1\le n\le50$ so that each integer in S is composite and relatively prime to every other integer in S. What is the largest possible number of integers in S?,4,,BmMT 2018 Team #15,2018,Number Theory,BmMT,2,
"Let ABCD be a regular tetrahedron and let W, X, Y, Z denote the centers of faces ABC, BCD, CDA, and DAB, respectively. What is the ratio of the volumes of tetrahedrons WXYZ and WAYZ? Express your answer as a decimal or a fraction in lowest terms.",1/2,,BmMT 2018 Team #16,2018,Geometry,BmMT,2.5,
"Consider a random permutation $\{s_{1},s_{2},...,s_{8}\}$ of $\{1,1,1,1,-1,-1,-1,-1\}$. Let S be the largest of the numbers
    \[s_{1},s_{1}+s_{2},s_{1}+s_{2}+s_{3},...,s_{1}+s_{2}+\cdot\cdot\cdot+s_{8}.\]
    What is the probability that S is exactly 3? Express your answer as a decimal or a fraction in lowest terms.",1/10,,BmMT 2018 Team #17,2018,Counting,BmMT,3,
"A positive integer is called almost-kinda-semi-prime if it has a prime number of positive integer divisors. Given that there are 168 primes less than 1000, how many almost-kinda-semi-prime numbers are there less than 1000?",184,,BmMT 2018 Team #18,2018,Number Theory,BmMT,3,
"Let ABCD be a unit square and let X, Y, Z be points on sides AB, BC, CD, respectively, such that $AX=BY=CZ.$ If the area of triangle XYZ is $\frac{1}{3}$ what is the maximum value of the ratio $XB/AX?$",2+√3,,BmMT 2018 Team #19,2018,Geometry,BmMT,3.5,
"Positive integers $a\le b\le c$ have the property that each of $a+b$, $b+c$, and $c+a$ are prime. If $a+b+c$ has exactly 4 positive divisors, find the fourth smallest possible value of the product $c(c+b)(c+b+a).$",50616,,BmMT 2018 Team #20,2018,Number Theory,BmMT,4.5,
"Find the maximum integral value of $k$ such that $0 \le k \le 2019$ and 
\[ \sin\left(\frac{2\pi k}{2019}\right) \]
is maximal.",1010,,BMT 2019 Team #1,2019,Algebra,BMT,4,
Find the remainder when $2^{2019}$ is divided by 7.,1,,BMT 2019 Team #2,2019,Number Theory,BMT,2,
"A cylinder with radius 5 and height 1 is rolling on the (unslanted) floor. Inside the cylinder, there is water that has constant height $\frac{15}{2}$ as the cylinder rolls on the floor. What is the volume of the water?",25√3/4 + 50π/3,,BMT 2019 Team #3,2019,Geometry,BMT,2,
"Let $C$ be the number of ways to arrange the letters of the word CATALYSIS, $T$ be the number of ways to arrange the letters of the word TRANSPORT, $S$ be the number of ways to arrange the letters of the word STRUCTURE, and $M$ be the number of ways to arrange the letters of the word MOTION. What is $\frac{C-T+S}{M}$?",126,,BMT 2019 Team #4,2019,Counting,BMT,2,
"What is the minimum distance between $(2019, 470)$ and $(21a-19b, 19b+21a)$ for $a, b \in \mathbb{Z}$?",√101,,BMT 2019 Team #5,2019,Geometry,BMT,2,
"At a party, 2019 people decide to form teams of three. To do so, each turn, every person not on a team points to one other person at random. If three people point to each other (that is, A points to B, B points to C, and C points to A), then they form a team. What is the probability that after 65,536 turns, exactly one person is not on a team?",0,,BMT 2019 Team #6,2019,Counting,BMT,2,
"How many distinct ordered pairs of integers $(b, m, t)$ satisfy the equation $b^8 + m^4 + t^2 + 1 = 2019^2$?",16,,BMT 2019 Team #7,2019,Number Theory,BMT,4,
"Let $(k_i)$ be a sequence of unique nonzero integers such that $x^2 - 5x + k_i$ has rational solutions. Find the minimum possible value of 
\[ \frac{1}{5} \sum_{i=1}^\infty \frac{1}{k_i}. \]",-137/1500,,BMT 2019 Team #8,2019,Algebra,BMT,4,
"You wish to color every vertex, edge, face, and the interior of a cube one color each such that no two adjacent objects are the same color. Faces are adjacent if they share an edge. Edges are adjacent if they share a vertex. The interior is adjacent to all of its faces, edges, and vertices. Each face is adjacent to all of its edges and vertices. Each edge is adjacent to both of its vertices. What is the minimum number of colors required to do this?",5,,BMT 2019 Team #9,2019,Counting,BMT,4.5,
Compute the remainder when the product of all positive integers less than and relatively prime to 2019 is divided by 2019.,1,,BMT 2019 Team #10,2019,Counting,BMT,5,
"2019 people (all of whom are perfect logicians), labeled from 1 to 2019, partake in a paintball duel. First, they decide to stand in a circle, in order, so that Person 1 has Person 2 to his left and Person 2019 to his right. Then, starting with Person 1 and moving to the left, every person who has not been eliminated takes a turn shooting. On their turn, each person can choose to either shoot one non-eliminated person of his or her choice (which eliminates that person from the game), or deliberately miss. The last person standing wins. If, at any point, play goes around the circle once with no one getting eliminated (that is, if all the people playing decide to miss), then automatic paint sprayers will turn on, and end the game with everyone losing. Each person will, on his or her turn, always pick a move that leads to a win if possible, and, if there is still a choice in what move to make, will prefer shooting over missing, and shooting a person closer to his or her left over shooting someone farther from their left. What is the number of the person who wins this game? Put ""0"" if no one wins.",1991,,BMT 2019 Team #12,2019,Counting,BMT,6,
"Triangle $\triangle ABC$ has $4R = 13$, $BC = 14$, and $CA = 15$. $\triangle ABC$ has incircle $\gamma$ and circumcircle $\omega$. Line $AI$ is extended to hit $\omega$ at $P$. What is the area of quadrilateral $ABPC$?",112,,BMT 2019 Team #13,2019,Geometry,BMT,4.5,
"A regular hexagon has positive integer side length. A laser is emitted from one of the hexagon's corners, and is reflected off the edges of the hexagon until it hits another corner. Let $a$ be the distance that the laser travels. What is the smallest possible value of $a^2$ such that $a > 2019$. You need not simplify/compute exponents.",4076364,,BMT 2019 Team #14,2019,Geometry,BMT,5,
"Let $p$ be a polynomial with degree less than 4 such that $p(x)$ attains a maximum at $x = 1$. If $p(1) = p(2) = 5$, find $p(10)$.",5,,BMT 2019 Individual #1,2019,Algebra,BMT,2,
"Let $A, B, C$ be unique collinear points with $AB = BC = 1$. Let $P$ be a point that lies on the circle centered at $B$ with radius $\frac{1}{3}$ and the circle centered at $C$ with radius $\frac{1}{3}$. Find the measure of angle $\angle PAC$ in degrees.",30,,BMT 2019 Individual #2,2019,Geometry,BMT,2,
"If $f(x + y) = f(xy)$ for all real numbers $x$ and $y$, and $f(2019) = 17$, what is the value of $f(17)$?",17,,BMT 2019 Individual #3,2019,Algebra,BMT,2.5,
"Justin is being served two different types of chips, A-chips, and B-chips. If there are 3 B-chips and 5 A-chips, and if Justin randomly grabs 3 chips, what is the probability that none of them are A-chips?",1/56,,BMT 2019 Individual #4,2019,Counting,BMT,2,
Point $P$ is $\sqrt{3}$ units away from plane $A$. Let $Q$ be a region of $A$ such that every line through $P$ that intersects $A$ in $Q$ intersects $A$ at an angle between $30^\circ$ and $60^\circ$. What is the largest possible area of $Q$?,8π,,BMT 2019 Individual #5,2019,Geometry,BMT,2.5,
"How many square inches of paint are needed to fully paint a regular 6-sided die with side length 2 inches, except for the $\frac{1}{3}$-inch diameter circular dots marking 1 through 6 (a different number per side)? The paint has negligible thickness, and the circular dots are non-overlapping.",24-7π/12,,BMT 2019 Individual #6,2019,Geometry,BMT,2,
"Let $\triangle ABC$ be an equilateral triangle with side length $M$ such that points $E_1$ and $E_2$ lie on side $AB$, $F_1$ and $F_2$ lie on side $BC$, and $G_1$ and $G_2$ lie on side $AC$, such that $m = AE_1 = BE_2 = BF_1 = CF_2 = CG_1 = AG_2$ and the area of polygon $E_1E_2F_1F_2G_1G_2$ equals the combined areas of $\triangle AE_1G_2$, $\triangle BF_1E_2$, and $\triangle CG_1F_2$. Find the ratio $\frac{m}{M}$.",√6/6,,BMT 2019 Individual #7,2019,Geometry,BMT,2.5,
"Let $\phi = \frac{1}{2019}$. Define
    \[
        g_n = \begin{cases}
            0 & \text{if } \text{round}(n\phi) = \text{round}((n-1)\phi) \\
            1 & \text{otherwise}.
        \end{cases}
    \]
    where $\text{round}(x)$ denotes the round function. Compute the expected value of $g_n$ if $n$ is an integer chosen from interval $[1, 2019^2]$.",1/2019,,BMT 2019 Individual #8,2019,Counting,BMT,2.5,
"Define an almost-palindrome as a string of letters that is not a palindrome but can become a palindrome if one of its letters is changed. For example, TRUST is an almost-palindrome because the R can be changed to an S to produce a palindrome, but TRIVIAL is not an almost-palindrome because it cannot be changed into a palindrome by swapping out only one letter (both the A and the L are out of place). How many almost-palindromes contain fewer than 4 letters?",17550,,BMT 2019 Individual #9,2019,Counting,BMT,2.5,
Let $MATH$ be a square with $MA = 1$. Point $B$ lies on $AT$ such that $m\angle MBT = 3.5m\angle BMT$. What is the area of $\triangle BMT$?,(√3 - 1)/2,,BMT 2019 Individual #10,2019,Geometry,BMT,3,
"A regular 17-gon with vertices $V_1, V_2, \dots, V_{17}$ and sides of length 3 has a point $P$ on $V_1V_2$ such that $V_1P = 1$. A chord that stretches from $V_1$ to $V_2$ containing $P$ is rotated within the interior of the heptendecagon around $V_2$ such that the chord now stretches from $V_2$ to $V_3$. The chord then hinges around $V_3$, then $V_4$, and so on, continuing until $P$ is back at its original position. Find the total length traced by $P$.",45π,,BMT 2019 Individual #11,2019,Geometry,BMT,3,
"Box is thinking of a number, whose digits are all “1”. When he squares the number, the sum of its digits is 85. How many digits is Box’s number?",11,,BMT 2019 Individual #12,2019,Number Theory,BMT,3.5,
"Two circles $O_1$ and $O_2$ intersect at points $A$ and $B$. Lines $AC$ and $BD$ are drawn such that $C$ is on $O_1$ and $D$ is on $O_2$ and $AC \perp AB$ and $BD \perp AB$. If minor arc $\stackrel{\frown}{AB} = 45$ degrees relative to $O_1$ and minor arc $\stackrel{\frown}{AB} = 60$ degrees relative to $O_2$ and the radius of $O_2 = 10$, the area of quadrilateral $CADB$ can be expressed in simplest form as $a + b\sqrt{k} + c\sqrt{\ell}$. Compute $a + b + c + k + \ell$.",155,,BMT 2019 Individual #13,2019,Geometry,BMT,3.5,
"On a 24 hour clock, there are two times after 01:00 for which the time expressed in the form hh:mm and in minutes are both perfect squares. One of these times is 01:21, since 121 and $60+21 = 81$ are both perfect squares. Find the other time, expressed in the form hh:mm.",20:25,,BMT 2019 Individual #14,2019,Number Theory,BMT,3,
How many distinct positive integers can be formed by choosing their digits from the string 04072019?,12340,,BMT 2019 Individual #15,2019,Counting,BMT,3,
"Let $ABC$ be a triangle with $AB = 26, BC = 51$, and $CA = 73$, and let $O$ be an arbitrary point in the interior of $\triangle ABC$. Lines $l_1, l_2$, and $l_3$ pass through $O$ and are parallel to $AB, BC$, and $CA$, respectively. The intersections of $l_1, l_2$, and $l_3$ and the sides of $\triangle ABC$ form a hexagon whose area is $A$. Compute the minimum value of $A$.",280,,BMT 2019 Individual #16,2019,Geometry,BMT,4.5,
"Let $C$ be a circle of radius 1 and $O$ its center. Let $AB$ be a chord of the circle and $D$ a point on $AB$ such that $OD = \frac{\sqrt{2}}{2}$ such that $D$ is closer to $A$ than it is to $B$, and if the perpendicular line at $D$ with respect to $AB$ intersects the circle at $E$ and $F$, $AD = DE$. The area of the region of the circle enclosed by $AD, DE$, and the minor arc $AE$ may be expressed as $\frac{a + b\sqrt{c} + d\pi}{e}$ where $a, b, c, d, e$ are integers, $\text{gcd}(a, b, d, e) = 1$, and $c$ is squarefree. Find $a + b + c + d + e$.",16,,BMT 2019 Individual #17,2019,Geometry,BMT,4.5,
"Define $f(x, y)$ to be $\frac{|x|}{|y|}$ if that value is a positive integer, $\frac{|y|}{|x|}$ if that value is a positive integer, and zero otherwise. We say that a sequence of integers $l_1$ through $l_n$ is good if $f(l_i, l_{i+1})$ is nonzero for all $i$ where $1 \le i \le n-1$, and the score of the sequence is
    \[
        \sum_{i=1}^{n-1} f(l_i, l_{i+1}).
    \]
    Compute the maximum possible score of a good subsequence subject to the further constraints that the absolute value of every element is between 2 and 6, and that if $b$ directly follows $a$ in the sequence, it can only do so once, and $a$ cannot directly follow $b$ afterwards.",37,,BMT 2019 Individual #18,2019,Number Theory,BMT,5.5,
"Let $a$ and $b$ be real numbers such that
    \[
        \max_{0 \le x \le 1} |x^3 - ax - b|
    \]
    is as small as possible. Find $a + b$ in simplest radical form. (Hint: If $f(x) = x^3 - cx - d$, then the maximum (or minimum) of $f(x)$ either occurs when $x = 0$ and/or $x = 1$ and/or when $x$ satisfies $3x^2 - c = 0$).",(9-√3)/9,,BMT 2019 Individual #19,2019,Algebra,BMT,6,
"Define a sequence $F_n$ such that $F_1 = 1, F_2 = x, F_{n+1} = xF_n + yF_{n-1}$ where $x$ and $y$ are positive integers. Suppose
    \[
        \frac{1}{F_k} = \sum_{n=1}^{\infty} \frac{F_n}{d^n}
    \]
    has exactly two solutions $(d, k)$ with $d > 0$ is a positive integer. Find the least possible positive value of $d$.",3,,BMT 2019 Individual #20,2019,Algebra,BMT,7,
How many integers $x$ satisfy $x^2 - 9x + 18 < 0$?,2,,BMT 2019 Algebra #1,2019,Algebra,BMT,2,
"Find the point $p$ in the first quadrant on the line $y = 2x$ such that the distance between $p$ and $p'$, the point reflected across the line $y = x$, is equal to $\sqrt{32}$.","(4, 8)",,BMT 2019 Algebra #2,2019,Algebra,BMT,2,
"There are several pairs of integers $(a, b)$ satisfying $a^2 - 4a + b^2 - 8b = 30$. Find the sum of the sum of the coordinates of all such points.",72,,BMT 2019 Algebra #3,2019,Algebra,BMT,2.5,
"Two real numbers $x$ and $y$ are both chosen at random from the closed interval $[-10, 10]$. Find the probability that $x^2 + y^2 < 10$. Express your answer as a common fraction in terms of $\pi$.",π/40,,BMT 2019 Algebra #4,2019,Algebra,BMT,2.5,
Find the sum of all real solutions to $(x^2 - 10x - 12)^{x^2 + 5x + 2} = 1$.,15,,BMT 2019 Algebra #5,2019,Algebra,BMT,2,
Find the maximum value of $\frac{x}{y}$ if $x$ and $y$ are real numbers such that $x^2 + y^2 - 8x - 6y + 20 = 0$.,11/2,,BMT 2019 Algebra #6,2019,Algebra,BMT,2.5,
"Let $r_1, r_2, r_3$ be the (possibly complex) roots of the polynomial $x^3 + ax^2 + bx + \frac{4}{3}$. How many pairs of integers $a, b$ exist such that $r_1^3 + r_2^3 + r_3^3 = 0$?",3,,BMT 2019 Algebra #7,2019,Algebra,BMT,3.5,
"A biased coin has a $\frac{6 + 2\sqrt{3}}{12}$ chance of landing heads, and a $\frac{6 - 2\sqrt{3}}{12}$ chance of landing tails. What is the probability that the number of times the coin lands heads after being flipped 100 times is a multiple of 4? The answer can be expressed as $\frac{1}{4} + \frac{1 + ab}{c \cdot de}$ where $a, b, c, d, e$ are positive integers. Find the minimal possible value of $a + b + c + d + e$.",67,,BMT 2019 Algebra #8,2019,Algebra,BMT,4,
"Let $a_n$ be the product of the complex roots of $x^{2n} = 1$ that are in the first quadrant of the complex plane. That is, roots of the form $a + bi$ where $a, b > 0$. Let $r = a_1 \cdot a_2 \cdot \dots \cdot a_{10}$. Find the smallest integer $k$ such that $r$ is a root of $x^k = 1$.",1260,,BMT 2019 Algebra #9,2019,Algebra,BMT,3.5,
"Find the number of ordered integer triplets $(x, y, z)$ with absolute value less than or equal to 100 such that $2x^2 + 3y^2 + 3z^2 + 2xy + 2xz - 4yz < 5$.",1401,,BMT 2019 Algebra #10,2019,Algebra,BMT,3,
A fair coin is repeatedly flipped until 2019 consecutive coin flips are the same. Compute the probability that the first and last flips of the coin come up differently.,(2^2018 - 1)/(2^2019 -1),,BMT 2019 Discrete #1,2019,Counting,BMT,4,
"Sylvia has a bag of 10 coins. Nine are fair coins, but the tenth has tails on both sides. Sylvia draws a coin at random from the bag and flips it without looking. If the coin comes up tails, what is the probability that the coin she drew was the 2-tailed coin?",2/11,,BMT 2019 Discrete #2,2019,Counting,BMT,3,
There are 15 people at a party; each person has 10 friends. To greet each other each person hugs all their friends. How many hugs are exchanged at this party?,75,,BMT 2019 Discrete #3,2019,Counting,BMT,3,
"There exists one pair of positive integers $a, b$ such that $100 > a > b > 0$ and $\frac{1}{a} + \frac{1}{b} = \frac{2}{35}$. Find $a + b$.",72,,BMT 2019 Discrete #4,2019,Number Theory,BMT,3,
Let $21110 \equiv n \pmod{1111}$ with $0 \le n < 1111$. Compute $n$.,1024,,BMT 2019 Discrete #5,2019,Number Theory,BMT,3,
Define $f(n) = \frac{n^2+n}{2}$. Compute the number of positive integers $n$ such that $f(n) \le 1000$ and $f(n)$ is the product of two prime numbers.,8,,BMT 2019 Discrete #6,2019,Number Theory,BMT,3,
"Call the number of times that the digits of a number change from increasing to decreasing, or vice versa, from the left to right while ignoring consecutive digits that are equal the flux of the number. For example, the flux of 123 is 0 (since the digits are always increasing from left to right) and the flux of 12333332 is 1, while the flux of 9182736450 is 8. What is the average value of the flux of the positive integers from 1 to 999, inclusive?",175/333,,BMT 2019 Discrete #7,2019,Counting,BMT,4,
"For a positive integer $n$, define $\phi(n)$ as the number of positive integers less than or equal to $n$ that are relatively prime to $n$. Find the sum of all positive integers $n$ such that $\phi(n) = 20$.",218,,BMT 2019 Discrete #8,2019,Number Theory,BMT,4,
"Let $z = \frac{1}{2} \left( \sqrt{2} + i\sqrt{2} \right)$. The sum
    \[
        \sum_{k=0}^{13} \frac{1}{1 - ze^{k \cdot i\pi/7}}
    \]
    can be written in the form $a - bi$. Find $a + b$.",14,,BMT 2019 Discrete #9,2019,Algebra,BMT,4.5,
