Problem latex,Answer,Solution,Source,Year,Type,Competition,Difficulty,Img
"How many subsets (including the empty-set) of $\{1,2 \ldots, 6\}$ do not have three consecutive integers?\\",44,,BMT 2016 Team #9,2016,Counting,BMT,3.5,
"What is the smallest possible perimeter of a triangle with integer coordinate vertices, area $\frac{1}{2}$, and no side parallel to an axis?\\",√2 + √5 + √13,,BMT 2016 Team #10,2016,Geometry,BMT,3.5,
"Circles $C_{1}$ and $C_{2}$ intersect at points $X$ and $Y$. Point $A$ is a point on $C_{1}$ such that the tangent line with respect to $C_{1}$ passing through $A$ intersects $C_{2}$ at $B$ and $C$, with $A$ closer to $B$ than $C$, such that 2016 $\cdot A B=B C$. Line $X Y$ intersects line $A C$ at $D$. If circles $C_{1}$ and $C_{2}$ have radii of 20 and 16 , respectively, find the ratio of $\sqrt{1+B C / B D}$.",2017,,BMT 2016 Team #11,2016,Geometry,BMT,3.5,
Consider a solid hemisphere of radius 1. Find the distance from its center of mass to the base.\\,3/8,,BMT 2016 Team #12,2016,Geometry,BMT,4,
"Consider an urn containing 51 white and 50 black balls. Every turn, we randomly pick a ball, record the color of the ball, and then we put the ball back into the urn. We stop picking when we have recorded $n$ black balls, where $n$ is an integer randomly chosen from $\{1,2, \ldots, 100\}$ What is the expected number of turns?",10201/100,,BMT 2016 Team #13,2016,Counting,BMT,4,
"Let $s_{1}, s_{2}, s_{3}$ be the three roots of $x^{3}+x^{2}+\frac{9}{2} x+9$.\\ $$ \prod_{i=1}^{3}\left(4 s_{i}^{4}+81\right) $$ \\ can be written as $2^{a} 3^{b} 5^{c}$. Find $a+b+c$.",16,,BMT 2016 Team #15,2016,Algebra,BMT,4.5,
Evaluate $1001^{3}-1000^{3}$,3003001,,BMT 2016 Analysis #1,2016,Algebra,BMT,2,
"Find an integer pair of solutions $(x, y)$ to the following system of equations. $$
\begin{aligned}
& \log _{2}\left(y^{x}\right)=16 \\
& \log _{2}\left(x^{y}\right)=8
\end{aligned}
$$","(16,2)",,BMT 2016 Analysis #2,2016,Algebra,BMT,2.5,
"A half-mile long train is traveling at a speed of 90 miles per hour. As it enters a 1 mile long tunnel, Steve starts running from the back of the train to the front of the train at a speed of 10 miles per hour. When Steve is out of the tunnel, he stops running. How far along the train has Steve run in miles?",3/20,,BMT 2016 Analysis #3,2016,Algebra,BMT,3,
An geometric progression starting at $a_{0}=3$ has an even number of terms. Suppose the difference between the odd indexed terms and even indexed terms is 39321 and that the sum of the first and last term is 49155 . Find the common ratio of this geometric progression.,4,,BMT 2016 Analysis #4,2016,Algebra,BMT,3,
"Find $$
\frac{\tan 1^{\circ}}{1+\tan 1^{\circ}}+\frac{\tan 2^{\circ}}{1+\tan 2^{\circ}}+\ldots+\frac{\tan 89^{\circ}}{1+\tan 89^{\circ}}
$$",89/2,,BMT 2016 Analysis #5,2016,Algebra,BMT,4,
"Find the coefficient of $x^{2}$ in the following polynomial $$
(1-x)^{2}(1+2 x)^{2}(1-3 x)^{2} \ldots(1-11 x)^{2}
$$",-434,,BMT 2016 Analysis #7,2016,Algebra,BMT,4.5,
"Evaluate $$
\sum_{k=0}^{\infty}\left(\frac{-1}{8}\right)^{k}\binom{2 k}{k}
$$",√6/3,,BMT 2016 Analysis #10,2016,Algebra,BMT,5,
A bag is filled with quarters and nickels. The average value when pulling out a coin is 10 cents. What is the least number of nickels in the bag possible?,3,,BMT 2016 Discrete #1,2016,Counting,BMT,2.5,
"How many integers from 1 to 2016 are divisible by 3 or 7 , but not 21 ?",768,,BMT 2016 Discrete #2,2016,Counting,BMT,2,
How many five-card hands from a standard deck of 52 cards are full houses? A full house consists of 3 cards of one rank and 2 cards of another rank.,3744,,BMT 2016 Discrete #3,2016,Counting,BMT,2.5,
Three 3-legged (distinguishable) Stanfurdians take off their socks and trade them with each other. How many ways is this possible if everyone ends up with exactly 3 socks and nobody gets any of their own socks? All socks originating from the Stanfurdians are distinguishable from each other. All Stanfurdian feet are indistinguishable from other feet of the same Stanfurdian.,56,,BMT 2016 Discrete #4,2016,Counting,BMT,3,
$(\sqrt{6}+\sqrt{7})^{1000}$ in base ten has a tens digit of $a$ and a ones digit of $b$. Determine $10 a+b$.,73,,BMT 2016 Discrete #9,2016,Number Theory,BMT,3,
A $2 \times 4 \times 8$ rectangular prism and a cube have the same volume. What is the difference between their surface areas?,16,,BMT 2016 Geometry #1,2016,Geometry,BMT,2,
"Cyclic quadrilateral $A B C D$ has side lengths $A B=6, B C=7, C D=7, D A=6$. What is the area of $A B C D$ ?",42,,BMT 2016 Geometry #2,2016,Geometry,BMT,2.5,
"Let $S$ be the set of all non-degenerate triangles with integer sidelengths, such that two of the sides are 20 and 16. Suppose we pick a triangle, at random, from this set. What is the probability that it is acute?",13/31,,BMT 2016 Geometry #3,2016,Geometry,BMT,2.5,
"$A B C$ is an equilateral triangle, and $A D E F$ is a square. If $D$ lies on side $A B$ and $E$ lies on side $B C$, what is the ratio of the area of the equilateral triangle to the area of the square?",√3/3 + 1/2,,BMT 2016 Geometry #4,2016,Geometry,BMT,2.5,
"Convex pentagon $A B C D E$ has the property that $\angle A D B=20^{\circ}, \angle B E C=16^{\circ}, \angle C A D=3^{\circ}$, and $\angle D B E=12^{\circ}$. What is the measure of $\angle E C A$ ?",129,,BMT 2016 Geometry #5,2016,Geometry,BMT,2.5,
"Triangle $A B C$ has sidelengths $A B=13, A C=14$, and $B C=15$ and centroid $G$. What is the area of the triangle with sidelengths $A G, B G$, and $C G$ ?",28,,BMT 2016 Geometry #6,2016,Geometry,BMT,3,
"Let $A B C$ be a right triangle with $A B=B C=2$. Construct point $D$ such that $\angle D A C=30^{\circ}$ and $\angle D C A=60^{\circ}$, and $\angle B C D>90^{\circ}$. Compute the area of triangle $B C D$.",(1+√3)/2,,BMT 2016 Geometry #7,2016,Geometry,BMT,3,
"Given right triangle $A B C$ with right angle at $C$, construct three external squares $A B D E$, $B C F G$, and $A C H I$. If $D G=19$ and $E I=22$, compute the length of $F H$.",13,,BMT 2016 Geometry #9,2016,Geometry,BMT,3.5,
"Triangle $A B C$ has side lengths $A B=5, B C=9$, and $A C=6$. Define the incircle of $A B C$ to be $C_{1}$. Then, define $C_{i}$ for $i>1$ to be externally tangent to $C_{i-1}$ and tangent to $A B$ and $B C$. Compute the sum of the areas of all circles $C_{n}$.",8π/3,,BMT 2016 Geometry #10,2016,Geometry,BMT,4,
"David is taking a 50 -question test, and he needs to answer at least $70 \%$ of the questions correctly in order to pass the test. What is the minimum number of questions he must answer correctly in order to pass the test?",35,,BmMT 2016 Individual #1,2016,Algebra,BmMT,1,
"You decide to flip a coin some number of times, and record each of the results. You stop flipping the coin once you have recorded either 20 heads, or 16 tails. What is the maximum number of times that you could have flipped the coin?",35,,BmMT 2016 Individual #2,2016,Counting,BmMT,1,
"The width of a rectangle is half of its length. Its area is 98 square meters. What is the length of the rectangle, in meters?",14,,BmMT 2016 Individual #3,2016,Geometry,BmMT,1,
"Carol is twice as old as her younger brother, and Carol's mother is 4 times as old as Carol is. The total age of all three of them is 55 . How old is Carol's mother?",40,,BmMT 2016 Individual #4,2016,Algebra,BmMT,1,
What is the sum of all two-digit multiples of 9?,585,,BmMT 2016 Individual #5,2016,Algebra,BmMT,1,
"The number 2016 is divisible by its last two digits, meaning that 2016 is divisible by 16 . What is the smallest integer larger than 2016 that is also divisible by its last two digits?",2020,,BmMT 2016 Individual #6,2016,Number Theory,BmMT,1,
Let $Q$ and $R$ both be squares whose perimeters add to 80 . The area of $Q$ to the area of $R$ is in a ratio of $16: 1$. Find the side length of $Q$.,16,,BmMT 2016 Individual #7,2016,Geometry,BmMT,1.5,
"How many 8 -digit positive integers have the property that the digits are strictly increasing from left to right? For instance, 12356789 is an example of such a number, while 12337889 is not.",9,,BmMT 2016 Individual #8,2016,Counting,BmMT,2,
"During a game, Steve Korry attempts 20 free throws, making 16 of them. How many more free throws does he have to attempt to finish the game with $84 \%$ accuracy, assuming he makes them all?",5,,BmMT 2016 Individual #9,2016,Algebra,BmMT,1.5,
How many different ways are there to arrange the letters MILKTEA such that TEA is a contiguous substring?,120,,BmMT 2016 Individual #10,2016,Counting,BmMT,2,
Suppose you roll two fair 20 -sided dice. What is the probability that their sum is divisible by 10 ?,1/10,,BmMT 2016 Individual #11,2016,Counting,BmMT,2,
"Suppose that two of the three sides of an acute triangle have lengths 20 and 16 , respectively. How many possible integer values are there for the length of the third side?",13,,BmMT 2016 Individual #12,2016,Geometry,BmMT,2.5,
"Suppose that between Beijing and Shanghai, an airplane travels 500 miles per hour, while a train travels at 300 miles per hour. You must leave for the airport 2 hours before your flight, and must leave for the train station 30 minutes before your train. Suppose that the two methods of transportation will take the same amount of time in total. What is the distance, in miles, between the two cities?",1125,,BmMT 2016 Individual #13,2016,Algebra,BmMT,2,
How many nondegenerate triangles (triangles where the three vertices are not collinear) with integer side lengths have a perimeter of 16 ? Two triangles are considered distinct if they are not congruent.,5,,BmMT 2016 Individual #14,2016,Geometry,BmMT,2.5,
"John can drive 100 miles per hour on a paved road and 30 miles per hour on a gravel road. If it takes John 100 minutes to drive a road that is 100 miles long, what fraction of the time does John spend on the paved road?",3/7,,BmMT 2016 Individual #15,2016,Algebra,BmMT,1.5,
"Alice rolls one pair of 6 -sided dice, and Bob rolls another pair of 6 -sided dice. What is the probability that at least one of Alice's dice shows the same number as at least one of Bob's dice?",37/72,,BmMT 2016 Individual #16,2016,Counting,BmMT,2,
"When $20^{16}$ is divided by $16^{20}$ and expressed in decimal form, what is the number of digits to the right of the decimal point? Trailing zeroes should not be included.",48,,BmMT 2016 Individual #17,2016,Number Theory,BmMT,2.5,
"Suppose you have a $20 \times 16$ bar of chocolate squares. You want to break the bar into smaller chunks, so that after some sequence of breaks, no piece has an area of more than 5 . What is the minimum possible number of times that you must break the bar? For an example of how breaking the chocolate works, suppose we have a $2 \times 2$ bar and wish to break it entirely into $1 \times 1$ bars. We can break it once to get two $2 \times 1$ bars. Then, we would have to break each of these individual bars in half in order to get all the bars to be size $1 \times 1$, and we end up using 3 breaks in total.",63,,BmMT 2016 Individual #18,2016,Counting,BmMT,3,
"A class of 10 students decides to form two distinguishable committees, each with 3 students. In how many ways can they do this, if the two committees can have no more than one student in common?",11760,,BmMT 2016 Individual #19,2016,Counting,BmMT,3,
"You have been told that you are allowed to draw a convex polygon in the Cartesian plane, with the requirements that each of the vertices has integer coordinates whose values range from 0 to 10 inclusive, and that no pair of vertices can share the same $x$ or $y$ coordinate value (so for example, you could not use both $(1,2)$ and $(1,4)$ in your polygon, but $(1,2)$ and $(2,1)$ is fine). What is the largest possible area that your polygon can have?",82,,BmMT 2016 Individual #20,2016,Geometry,BmMT,3.5,
"BmMT is in a week, and we don't have any problems! Let's write 1 on the first day, 2 on the second day, 4 on the third, 8 on the fourth, 16 on the fifth, 32 on the sixth, and 64 on the seventh. After seven days, how many problems will we have written in total?",127,,BmMT 2016 Team #1,2016,Algebra,BmMT,1,
"100 students are taking a ten-point exam. 50 students scored 8 points, 30 students scored 7 points, and the rest scored 9 points. What is the average score for the exam?",7.9,,BmMT 2016 Team #2,2016,Algebra,BmMT,1,
"Rebecca has four pairs of shoes. Rebecca may or may not wear matching shoes. However, she will always use a left-shoe for her left foot and a right-shoe for her right foot. How many ways can Rebecca wear shoes?",16,,BmMT 2016 Team #3,2016,Counting,BmMT,1,
"A council of 111 mathematicians voted on whether to hold their conference in Beijing or Shanghai. The outcome of an initial vote was 70 votes in favor of Beijing, and 41 votes in favor of Shanghai. If the vote were to be held again, what is the minimum number of mathematicians that would have to change their votes in order for Shanghai to win a majority of votes?",15,,BmMT 2016 Team #4,2016,Counting,BmMT,1,
"What is the area of the triangle bounded by the line $20 x+16 y=160$, the $x$-axis, and the $y$-axis?",40,,BmMT 2016 Team #5,2016,Geometry,BmMT,1,
"Suppose that 3 runners start running from the start line around a circular 800 -meter track and that their speeds are 100,160 , and 200 meters per minute, respectively. How many minutes will they run before all three are next at the start line at the same time?",40,,BmMT 2016 Team #6,2016,Number Theory,BmMT,1.5,
"Brian's lawn is in the shape of a circle, with radius 10 meters. Brian can throw a frisbee up to 50 meters from where he stands. What is the area of the region (in square meters) in which the frisbee can land, if Brian can stand anywhere on his lawn?",3600π,,BmMT 2016 Team #7,2016,Geometry,BmMT,1.5,
"A seven digit number is called ""bad"" if exactly four of its digits are 0 and the rest are odd. How many seven digit numbers are bad?",1875,,BmMT 2016 Team #8,2016,Counting,BmMT,1.5,
Suppose you have a 3 -digit number with only even digits. What is the probability that twice that number also has only even digits?,9/50,,BmMT 2016 Team #9,2016,Counting,BmMT,1.5,
"You have a flight on Air China from Beijing to New York. The flight will depart any time between 1 p.m. and 6 p.m., uniformly at random. Your friend, Henry, is flying American Airlines, also from Beijing to New York. Henry's flight will depart any time between 3 p.m. and 5 p.m., uniformly at random. What is the probability that Henry's flight departs before your flight?",2/5,,BmMT 2016 Team #10,2016,Counting,BmMT,2,
Consider a circle of radius 1 drawn tangent to the positive $x$ and $y$ axes. Now consider another smaller circle tangent to that circle and also tangent to the positive $x$ and $y$ axes. Find the radius of the smaller circle.,3-2√2,,BmMT 2016 Team #12,2016,Geometry,BmMT,2,
"The following expression is an integer. Find this integer: $$
\frac{\sqrt{20+16 \frac{\sqrt{20+16 \frac{\sqrt{20+16 \ldots}}{2}}}{2}}}{2} .
$$",5,,BmMT 2016 Team #13,2016,Algebra,BmMT,2,
"Let $2016=a_{1} \times a_{2} \times \cdots \times a_{n}$ for some positive integers $a_{1}, a_{2}, \ldots, a_{n}$. Compute the smallest possible value of $a_{1}+a_{2}+\cdots+a_{n}$.",23,,BmMT 2016 Team #14,2016,Number Theory,BmMT,2.5,
"The tetranacci numbers are defined by the recurrence $T_{n}=T_{n-1}+T_{n-2}+T_{n-3}+T_{n-4}$ and $T_{0}=T_{1}=T_{2}=0$ and $T_{3}=1$. Given that $T_{9}=29$ and $T_{14}=773$, calculate $T_{15}$.",1490,,BmMT 2016 Team #15,2016,Algebra,BmMT,2,
"Find the number of zeros at the end of $(2016!)^{2016}$. Your answer should be an integer, not its prime factorization.",1012032,,BmMT 2016 Team #16,2016,Number Theory,BmMT,2.5,
"A DJ has 7 songs named $1,2,3,4,5,6$, and 7 . He decides that no two even-numbered songs can be played one after the other. In how many different orders can the DJ play the 7 songs?",1440,,BmMT 2016 Team #17,2016,Counting,BmMT,2,
"Given a cube, how many distinct ways are there (using 6 colors) to color each face a distinct color? Colorings are distinct if they cannot be transformed into one another by a sequence of rotations.",30,,BmMT 2016 Team #18,2016,Counting,BmMT,2.5,
"Suppose you have a triangle with side lengths 3,4 , and 5 . For each of the triangle's sides, draw a square on its outside. Connect the adjacent vertices in order, forming 3 new triangles (as in the diagram). What is the area of this convex region?\\",74,,BmMT 2016 Team #19,2016,Geometry,BmMT,3,
Find $x$ such that $\sqrt{c+\sqrt{c-x}}=x$ when $c=4$.,(1+√13)/2,,BmMT 2016 Team #20,2016,Algebra,BmMT,3,
"In three years, Xingyou's age in years will be twice his current height in feet. If Xingyou's current age in years is also his current height in feet, what is Xingyou's age in years right now?",3,,BMT 2017 Individual #1,2017,Algebra,BMT,1,
"Barack is an equilateral triangle and Michelle is a square. If Barack and Michelle each have perimeter 12, find the area of the polygon with larger area.",9,,BMT 2017 Individual #2,2017,Geometry,BMT,1,
How many letters in the word UNCOPYRIGHTABLE have at least one line of symmetry?,10,,BMT 2017 Individual #3,2017,Geometry,BMT,1,
There are two 3-digit numbers which end in 99. These two numbers are also the product of two integers which differ by 2. What is the sum of these two numbers?,1298,,BMT 2017 Individual #4,2017,Number Theory,BMT,2,
"How many pairs of positive integers $(a, b)$ satisfy the equation $\log_{a}16=b?$",5,,BMT 2017 Individual #5,2017,Algebra,BMT,1.5,
For how many numbers n does 2017 divided by n have a remainder of either 1 or 2?,42,,BMT 2017 Individual #6,2017,Number Theory,BMT,1.5,
What is the sum of the infinite series $\frac{20}{3}+\frac{17}{9}+\frac{20}{27}+\frac{17}{81}+\frac{20}{243}+\frac{17}{729}+...?$,77/8,,BMT 2017 Individual #7,2017,Algebra,BMT,1.5,
"If $xy=15$ and $x+y=11$, calculate the value of $x^{3}+y^{3}$.",836,,BMT 2017 Individual #8,2017,Algebra,BMT,1.5,
"The digits 1, 4, 9 and 2 are each used exactly once to form some 4-digit number N. What is the sum of all possible values of N?",106656,,BMT 2017 Individual #9,2017,Algebra,BMT,1.5,
"Let S be the set of points A in the Cartesian plane such that the four points A, (2, 3), (-1,0), and (0,6) form the vertices of a parallelogram. Let P be the convex polygon whose vertices are the points in S. What is the area of P?",30,,BMT 2017 Individual #10,2017,Geometry,BMT,2.5,
"Naomi has a class of 100 students who will compete with each other in five teams. Once the teams are made, each student will shake hands with every other student, except the students in his or her own team. Naomi chooses to partition the students into teams so as to maximize the number of handshakes. How many handshakes will there be?",4000,,BMT 2017 Individual #11,2017,Counting,BMT,2.5,
"Square S is the unit square with vertices at (0,0), (0,1), (1,0) and (1, 1). We choose a random point $(x, y)$ inside S and construct a rectangle with length $x$ and width $y$. What is the average of $\lfloor p \rfloor$ where $p$ is the perimeter of the rectangle? $\lfloor x \rfloor$ is the greatest integer less than or equal to $x$.",3/2,,BMT 2017 Individual #12,2017,Counting,BMT,2.5,
"Two points are located 10 units apart, and a circle is drawn with radius r centered at one of the points. A tangent line to the circle is drawn from the other point. What value of r maximizes the area of the triangle formed by the two points and the point of tangency?",5√2,,BMT 2017 Individual #13,2017,Geometry,BMT,2.5,
"Let x be the first term in the sequence 31, 331, 3331,... which is divisible by 17. How many digits long is x?",9,,BMT 2017 Individual #14,2017,Number Theory,BMT,3,
"Alice and Bob live on the edges and vertices of the unit cube. Alice begins at point (0,0,0) and Bob begins at (1,1,1). Every second, each of them chooses one of the three adjacent corners and walks at a constant rate of 1 unit per second along the edge until they reach the corner, after which they repeat the process. What is the expected amount of time in seconds before Alice and Bob meet?",13,,BMT 2017 Individual #15,2017,Counting,BMT,3,
"Let ABC be a triangle with $AB=3$, $BC=5$, $AC=7,$ and let P be a point in its interior. If $G_{A}$, $G_{B}$, $G_{C}$ are the centroids of $\triangle PBC,$ $\triangle PAC,$ $\triangle PAB$ respectively, find the maximum possible area of $\triangle G_{A}G_{B}G_{C}$.",5√3/12,,BMT 2017 Individual #16,2017,Geometry,BMT,4.5,
"Triangle ABC is drawn such that $\angle A=80^{\circ}$, $\angle B=60^{\circ}$ and $\angle C=40^{\circ}$. Let the circumcenter of $\triangle ABC$ be O, and let w be the circle with diameter AO. Circle w intersects side AC at point P. Let M be the midpoint of side BC, and let the intersection of w and PM be K. Find the measure of $\angle MOK.$",120,,BMT 2017 Individual #17,2017,Geometry,BMT,5,
"Consider the sequence $(k_{n})$ defined by $k_{n+1}=n(k_{n}+k_{n-1})$ and $k_{0}=0$, $k_{1}=1$. What is $\lim_{n\rightarrow\infty}\frac{k_{n}}{n!}$?",1-1/e,,BMT 2017 Individual #18,2017,Algebra,BMT,5,
"Let T be the triangle in the xy-plane with vertices (0,0), (3,0), and (0,3). Let E be the ellipse inscribed in T which meets each side of T at its midpoint. Find the distance from the center of E to (0,0).",√5/2,,BMT 2017 Individual #19,2017,Geometry,BMT,4.5,
Evaluate $\sum_{k=0}^{15}2^{560}(-1)^{k}\cos^{560}(\frac{k\pi}{16}) \pmod{17}$.,15,,BMT 2017 Individual #20,2017,Algebra,BMT,4.5,
"You are racing an Artificially Intelligent Robot, called Al, that you built. You can run at a constant speed of $10~m/s$ throughout the race. Meanwhile, Al starts running at a constant speed of $1~m/s$. Thereafter, when exactly 1 second has passed from when Al last changed its speed, Al's speed instantaneously becomes $1~m/s$ faster, so that Al runs at a constant speed of $k~m/s$ in the kth second of the race. (Start counting seconds at 1). Suppose Al beats you by exactly 1 second. How many meters was the race?",210,,BMT 2017 Team #1,2017,Algebra,BMT,1.5,
"Colin has 900 Choco Pies. He realizes that for some integer values of $n<900$, if he eats n pies a day, he will be able to eat the same number of pies every day until he runs out. How many possible values of n are there?",27,,BMT 2017 Team #2,2017,Number Theory,BMT,1.5,
"Suppose we have $w<x<y<z$, and each of the 6 pairwise sums are distinct. The 4 greatest sums are 4, 3, 2, 1. What is the sum of all possible values of w?",-5/2,,BMT 2017 Team #3,2017,Algebra,BMT,2.5,
"2 darts are thrown randomly at a circular board with center O, such that each dart has an equal probability of hitting any point on the board. The points at which they land are marked A and B. What is the probability that $\angle AOB$ is acute?",1/2,,BMT 2017 Team #4,2017,Counting,BMT,2,
"You enter an elevator on floor 0 of a building with some other people, and request to go to floor 10. In order to be efficient, it doesn't stop at adjacent floors (so, if it's at floor 0, its next stop cannot be floor 1). Given that the elevator will stop at floor 10, no matter what other floors it stops at, how many combinations of stops are there for the elevator?",55,,BMT 2017 Team #5,2017,Counting,BMT,3,
"The center of a square of side length 1 is placed uniformly at random inside a circle of radius 1. Given that we are allowed to rotate the square about its center, what is the probability that the entire square is contained within the circle for some orientation of the square?",1-√3/2,,BMT 2017 Team #6,2017,Geometry,BMT,3.5,
"There are 86400 seconds in a day, which can be deduced from the conversions between seconds, minutes, hours, and days. However, the leading scientists decide that we should decide on 3 new integers $x$, $y$, and $z$, such that there are $x$ seconds in a minute, $y$ minutes in an hour, and $z$ hours in a day, such that $xyz=86400$ as before, but such that the sum $x+y+z$ is minimized. What is the smallest possible value of that sum?",133,,BMT 2017 Team #7,2017,Algebra,BMT,3.5,
"A function f with its domain on the positive integers $\mathbb{N}=\{1,2,...\}$ satisfies the following conditions: \\(a): $f(1)=2017$ \\(b): $\sum_{i=1}^{n}f(i)=n^{2}f(n)$, for every positive integer $n>1$. \\What is the value of $f(2017)$?",1/1009,,BMT 2017 Team #8,2017,Algebra,BMT,3.5,
Let $AB=10$ be a diameter of circle P. Pick point C on the circle such that $AC=8$ Let the circle with center O be the incircle of $\triangle ABC.$ Extend line AO to intersect circle P again at D. Find the length of BD.,√10,,BMT 2017 Team #9,2017,Geometry,BMT,4,
"You and your friend play a game on a $7\times7$ grid of buckets. Your friend chooses 5 ""lucky"" buckets by marking an $X^{\prime\prime}$ on the bottom that you cannot see. However, he tells you that they either form a vertical, or horizontal line of length 5. To clarify, he will select either of the following sets of buckets: \\either $\{(a,b),(a,b+1),(a,b+2),(a,b+3),(a,b+4)\}$ or $\{(b,a),(b+1,a),(b+2,a),(b+3,a),(b+4,a)\},$ with \\ $1\le a\le7$, and $1\le b\le3$ Your friend lets you pick up at most n buckets, and you win if one of the buckets you picked was a ""lucky"" bucket. What is the minimum possible value of n such that, if you pick your buckets optimally, you can guarantee that at least one is ""lucky""?",9,,BMT 2017 Team #10,2017,Counting,BMT,3.5,
"Ben picks a positive number n less than 2017 uniformly at random. Then Rex, starting with the number 1, repeatedly multiplies his number by n and then finds the remainder when dividing by 2017. Rex does this until he gets back to the number 1. What is the probability that, during this process, Rex reaches every positive number less than 2017 before returning back to 1?",2/7,,BMT 2017 Team #11,2017,Number Theory,BMT,3.5,
